{
  "object": "list",
  "url": "/v1/invoices",
  "count": 1,
  "data": [
    {
    "date": 1381134043,
    "id": "in_2hzEcE91Q3iHBb",
    "period_start": 1381134043,
    "period_end": 1381134043,
    "lines": {
      "data": [
        {
          "id": "su_2i0bDIlnaMV0Vq",
          "object": "line_item",
          "type": "subscription",
          "livemode": true,
          "amount": 100,
          "currency": "usd",
          "proration": false,
          "period": {
            "start": 1383817571,
            "end": 1386409571
          },
          "quantity": 1,
          "plan": {
            "interval": "month",
            "name": "Java Bindings Plan",
            "amount": 100,
            "currency": "usd",
            "id": "JAVA-PLAN-dbfd01a0-c28c-421d-8ae9-5a999575fa1b",
            "object": "plan",
            "livemode": false,
            "interval_count": 1,
            "trial_period_days": null
          },
          "description": null
        }
      ],
      "count": 1,
      "object": "list",
      "url": "/v1/invoices/in_2hzEcE91Q3iHBb/lines"
    },
    "subtotal": 0,
    "total": 0,
    "customer": "cus_2hzElrZhmfV9my",
    "object": "invoice",
    "attempted": true,
    "closed": true,
    "paid": true,
    "livemode": false,
    "attempt_count": 0,
    "amount_due": 0,
    "currency": "usd",
    "starting_balance": 0,
    "ending_balance": null,
    "next_payment_attempt": null,
    "charge": null,
    "discount": null,
    "application_fee": null
  }
  ]
}