{
  "object": "list",
  "url": "/v1/coupons",
  "count": 1,
  "data": [
    {
    "id": "259FF",
    "percent_off": 25,
    "amount_off": null,
    "currency": "usd",
    "object": "coupon",
    "livemode": false,
    "duration": "repeating",
    "redeem_by": null,
    "max_redemptions": null,
    "times_redeemed": 0,
    "duration_in_months": 3
  }
  ]
}