{
  "object": "list",
  "url": "/v1/events",
  "count": 1,
  "data": [
    {
    "id": "evt_2i0bkMsBaZwLp1",
    "created": 1381139159,
    "livemode": false,
    "type": "charge.succeeded",
    "data": {
      "object": {
        "id": "ch_2i0bEetfZQnWS2",
        "object": "charge",
        "created": 1381139159,
        "livemode": false,
        "paid": true,
        "amount": 500,
        "currency": "usd",
        "refunded": false,
        "card": {
          "id": "card_2i0baJexR7HVae",
          "object": "card",
          "last4": "4242",
          "type": "Visa",
          "exp_month": 1,
          "exp_year": 2050,
          "fingerprint": "qhjxpr7DiCdFYTlH",
          "customer": null,
          "country": "US",
          "name": null,
          "address_line1": null,
          "address_line2": null,
          "address_city": null,
          "address_state": null,
          "address_zip": null,
          "address_country": null,
          "cvc_check": "pass",
          "address_line1_check": null,
          "address_zip_check": null
        },
        "captured": true,
        "refunds": [
  
        ],
        "balance_transaction": "txn_2i0bWLMtt8QnOF",
        "failure_message": null,
        "failure_code": null,
        "amount_refunded": 0,
        "customer": null,
        "invoice": null,
        "description": null,
        "dispute": null,
        "metadata": {
        }
      }
    },
    "object": "event",
    "pending_webhooks": 0,
    "request": "iar_2i0bwZ3Bh7TiPp"
  }
  ]
}