{
  "object": "list",
  "url": "/v1/invoices/in_2hzEcE91Q3iHBb/lines",
  "count": 1,
  "data": [
    {
    "id": "ii_2Xovytvup4IajJ",
    "object": "line_item",
    "type": "invoiceitem",
    "livemode": false,
    "amount": 1,
    "currency": "usd",
    "proration": true,
    "period": {
      "start": 1378789336,
      "end": 1378789336
    },
    "quantity": null,
    "plan": null,
    "description": "Remaining time on Prep Plan 2 after 10 Sep 2013"
  }
  ]
}